01001	0100	Butter, salted
01002	0100	Butter, whipped, with salt
01003	0100	Butter oil, anhydrous
01004	0100	Cheese, blue
01005	0100	Cheese, brick
01006	0100	Cheese, brie
01007	0100	Cheese, camembert
01009	0100	Cheese, cheddar
01011	0100	Cheese, colby
01012	0100	Cheese, cottage, creamed, large or small curd
01013	0100	Cheese, cottage, creamed, with fruit
01014	0100	Cheese, cottage, nonfat, uncreamed, dry, large or small curd
01015	0100	Cheese, cottage, lowfat, 2% milkfat
01016	0100	Cheese, cottage, lowfat, 1% milkfat
01017	0100	Cheese, cream
01018	0100	Cheese, edam
01019	0100	Cheese, feta
01020	0100	Cheese, fontina
01022	0100	Cheese, gouda
01023	0100	Cheese, gruyere
01024	0100	Cheese, limburger
01025	0100	Cheese, monterey
01026	0100	Cheese, mozzarella, whole milk
01027	0100	Cheese, mozzarella, whole milk, low moisture
01028	0100	Cheese, mozzarella, part skim milk
01029	0100	Cheese, mozzarella, low moisture, part-skim
01030	0100	Cheese, muenster
01032	0100	Cheese, parmesan, grated
01033	0100	Cheese, parmesan, hard
01034	0100	Cheese, port de salut
01035	0100	Cheese, provolone
01036	0100	Cheese, ricotta, whole milk
01037	0100	Cheese, ricotta, part skim milk
01038	0100	Cheese, romano
01040	0100	Cheese, swiss
01042	0100	Cheese, pasteurized process, American, fortified with vitamin D
01043	0100	Cheese, pasteurized process, pimento
01044	0100	Cheese, pasteurized process, swiss
01046	0100	Cheese food, pasteurized process, American, vitamin D fortified
01048	0100	Cheese spread, pasteurized process, American
01049	0100	Cream, fluid, half and half
01050	0100	Cream, fluid, light (coffee cream or table cream)
01052	0100	Cream, fluid, light whipping
01053	0100	Cream, fluid, heavy whipping
01054	0100	Cream, whipped, cream topping, pressurized
01055	0100	Cream, sour, reduced fat, cultured
01056	0100	Cream, sour, cultured
01057	0100	Eggnog
01058	0100	Sour dressing, non-butterfat, cultured, filled cream-type
01061	0100	Cheese, American, nonfat or fat free
01067	0100	Cream substitute, liquid, with hydrogenated vegetable oil and soy protein
01069	0100	Cream substitute, powdered
01071	0100	Dessert topping, powdered, 1.5 ounce prepared with 1/2 cup milk
01072	0100	Dessert topping, pressurized
01073	0100	Dessert topping, semi solid, frozen
01074	0100	Sour cream, imitation, cultured
01077	0100	Milk, whole, 3.25% milkfat, with added vitamin D
01079	0100	Milk, reduced fat, fluid, 2% milkfat, with added vitamin A and vitamin D
01082	0100	Milk, lowfat, fluid, 1% milkfat, with added vitamin A and vitamin D
01085	0100	Milk, nonfat, fluid, with added vitamin A and vitamin D (fat free or skim)
01088	0100	Milk, buttermilk, fluid, cultured, lowfat
01089	0100	Milk, low sodium, fluid
01090	0100	Milk, dry, whole, with added vitamin D
01091	0100	Milk, dry, nonfat, regular, without added vitamin A and vitamin D
01092	0100	Milk, dry, nonfat, instant, with added vitamin A and vitamin D
01094	0100	Milk, buttermilk, dried
01095	0100	Milk, canned, condensed, sweetened
01096	0100	Milk, canned, evaporated, with added vitamin D and without added vitamin A
01097	0100	Milk, canned, evaporated, nonfat, with added vitamin A and vitamin D
01102	0100	Milk, chocolate, fluid, commercial, whole, with added vitamin A and vitamin D
01103	0100	Milk, chocolate, fluid, commercial, reduced fat, with added vitamin A and vitamin D
01104	0100	Milk, chocolate, lowfat, with added vitamin A and vitamin D
01106	0100	Milk, goat, fluid, with added vitamin D
01107	0100	Milk, human, mature, fluid
01113	0100	Whey, acid, dried
01115	0100	Whey, sweet, dried
01116	0100	Yogurt, plain, whole milk, 8 grams protein per 8 ounce
01117	0100	Yogurt, plain, low fat, 12 grams protein per 8 ounce
01118	0100	Yogurt, plain, skim milk, 13 grams protein per 8 ounce
01119	0100	Yogurt, vanilla, low fat, 11 grams protein per 8 ounce
01120	0100	Yogurt, fruit, low fat, 9 grams protein per 8 ounce
01121	0100	Yogurt, fruit, low fat, 10 grams protein per 8 ounce
01123	0100	Egg, whole, raw, fresh
01124	0100	Egg, white, raw, fresh
01125	0100	Egg, yolk, raw, fresh
01128	0100	Egg, whole, cooked, fried
01129	0100	Egg, whole, cooked, hard-boiled
01130	0100	Egg, whole, cooked, omelet
01131	0100	Egg, whole, cooked, poached
01132	0100	Egg, whole, cooked, scrambled
01133	0100	Egg, whole, dried
01136	0100	Egg, white, dried, powder, stabilized, glucose reduced
01137	0100	Egg, yolk, dried
01138	0100	Egg, duck, whole, fresh, raw
01139	0100	Egg, goose, whole, fresh, raw
01140	0100	Egg, quail, whole, fresh, raw
01144	0100	Egg substitute, powder
01145	0100	Butter, without salt
01151	0100	Milk, nonfat, fluid, without added vitamin A and vitamin D (fat free or skim)
01154	0100	Milk, dry, nonfat, regular, with added vitamin A and vitamin D
01155	0100	Milk, dry, nonfat, instant, without added vitamin A and vitamin D
01156	0100	Cheese, goat, hard type
01157	0100	Cheese, goat, semisoft type
01159	0100	Cheese, goat, soft type
01161	0100	Cheese substitute, mozzarella
01164	0100	Cheese sauce, prepared from recipe
01165	0100	Cheese, mexican, queso anejo
01166	0100	Cheese, mexican, queso asadero
01167	0100	Cheese, mexican, queso chihuahua
01168	0100	Cheese, low fat, cheddar or colby
01169	0100	Cheese, low-sodium, cheddar or colby
01174	0100	Milk, reduced fat, fluid, 2% milkfat, without added vitamin A and vitamin D
01175	0100	Milk, fluid, 1% fat, without added vitamin A and vitamin D
01178	0100	Sour cream, reduced fat
01179	0100	Sour cream, light
01180	0100	Sour cream, fat free
01182	0100	USDA Commodity, cheese, cheddar, reduced fat
01184	0100	Yogurt, vanilla or lemon flavor, nonfat milk, sweetened with low-calorie sweetener
01185	0100	Parmesan cheese topping, fat free
01186	0100	Cheese, cream, fat free
01187	0100	Yogurt, chocolate, nonfat milk
01199	0100	Cream, half and half, fat free
01200	0100	Reddi Wip Fat Free Whipped Topping
01203	0100	Yogurt, fruit, lowfat, with low calorie sweetener
01204	0100	Cheese, parmesan, dry grated, reduced fat
01205	0100	Cream substitute, flavored, liquid
01206	0100	Cream substitute, flavored, powdered
01208	0100	Cheese, provolone, reduced fat
01209	0100	Cheese, Mexican, blend, reduced fat
01211	0100	Milk, whole, 3.25% milkfat, without added vitamin A and vitamin D
01212	0100	Milk, dry, whole, without added vitamin D
01214	0100	Milk, canned, evaporated, without added vitamin A and vitamin D
01215	0100	Cheese product, pasteurized process, American, reduced fat, fortified with vitamin D
01216	0100	Yogurt, fruit, low fat, 9 grams protein per 8 ounce, fortified with vitamin D
01217	0100	Yogurt, fruit, low fat, 10 grams protein per 8 ounce, fortified with vitamin D
01218	0100	Yogurt, fruit variety, nonfat, fortified with vitamin D
01219	0100	Yogurt, fruit, lowfat, with low calorie sweetener, fortified with vitamin D
01220	0100	Yogurt, vanilla, low fat, 11 grams protein per 8 ounce, fortified with vitamin D
01221	0100	Yogurt, vanilla or lemon flavor, nonfat milk, sweetened with low-calorie sweetener, fortified with vitamin D
01222	0100	Yogurt, chocolate, nonfat milk, fortified with vitamin D
01223	0100	Protein supplement, milk based, Muscle Milk, powder
01224	0100	Protein supplement, milk based, Muscle Milk Light, powder
01225	0100	Dulce de Leche
01226	0100	Egg substitute, liquid or frozen, fat free
01228	0100	Cheese, fresh, queso fresco
01230	0100	Milk, buttermilk, fluid, whole
01231	0100	Yogurt, vanilla flavor, lowfat milk, sweetened with low calorie sweetener
01235	0100	Yogurt, frozen, flavors not chocolate, nonfat milk, with low-calorie sweetener
01236	0100	Ice cream, soft serve, chocolate
01237	0100	Ice cream, bar or stick, chocolate covered
01238	0100	Ice cream sandwich
01239	0100	Ice cream cookie sandwich
01240	0100	Ice cream cone, chocolate covered, with nuts, flavors other than chocolate
01241	0100	Ice cream sandwich, made with light ice cream, vanilla
01242	0100	Ice cream sandwich, vanilla, light, no sugar added
01243	0100	Fat free ice cream, no sugar added, flavors other than chocolate
01244	0100	Milk dessert bar, frozen, made from lowfat milk
01250	0100	Nutritional supplement for people with diabetes, liquid
01251	0100	Cheese, Mexican blend
01252	0100	Cheese product, pasteurized process, American, vitamin D fortified
01253	0100	Cheese, pasteurized process, American, without added vitamin D
01254	0100	Cheese food, pasteurized process, American, without added vitamin D
01256	0100	Yogurt, Greek, plain, nonfat
01259	0100	Cheese spread, American or Cheddar cheese base, reduced fat
01260	0100	Cheese, cheddar, reduced fat
01263	0100	Ice cream, light, soft serve, chocolate
01264	0100	Ice cream bar, stick or nugget, with crunch coating
01265	0100	Cheese, cheddar, nonfat or fat free
01266	0100	Cheese, Swiss, nonfat or fat free
01267	0100	Cheese, mexican, queso cotija
01270	0100	Cheese, cheddar, sharp, sliced
01271	0100	Cheese, mozzarella, low moisture, part-skim, shredded
01284	0100	Yogurt, Greek, strawberry, lowfat
01285	0100	Yogurt, Greek, strawberry, nonfat
01286	0100	Yogurt, Greek, vanilla, nonfat
01287	0100	Yogurt, Greek, plain, lowfat
01289	0100	Kefir, lowfat, plain, LIFEWAY
01290	0100	Kefir, lowfat, strawberry, LIFEWAY
01291	0100	Milk, evaporated, 2% fat, with added vitamin A and vitamin D
01292	0100	Milk, chocolate, fat free, with added vitamin A and vitamin D
01293	0100	Yogurt, Greek, plain, whole milk
01294	0100	Yogurt, Greek, fruit, whole milk
01295	0100	Yogurt, vanilla, non-fat
01297	0100	Yogurt, Greek, vanilla, lowfat
01298	0100	Yogurt, frozen, flavors other than chocolate, lowfat
01300	0100	Ice cream bar, covered with chocolate and nuts
01301	0100	Ice cream sundae cone
01302	0100	Light ice cream, Creamsicle
01303	0100	Cream, half and half, lowfat
01305	0100	Milk, chocolate, lowfat, reduced sugar
01306	0100	Ice cream, lowfat, no sugar added, cone, added peanuts and chocolate sauce
02003	0200	Spices, basil, dried
02005	0200	Spices, caraway seed
02007	0200	Spices, celery seed
02009	0200	Spices, chili powder
02010	0200	Spices, cinnamon, ground
02011	0200	Spices, cloves, ground
02012	0200	Spices, coriander leaf, dried
02014	0200	Spices, cumin seed
02015	0200	Spices, curry powder
02020	0200	Spices, garlic powder
02021	0200	Spices, ginger, ground
02023	0200	Spices, marjoram, dried
02024	0200	Spices, mustard seed, ground
02025	0200	Spices, nutmeg, ground
02026	0200	Spices, onion powder
02027	0200	Spices, oregano, dried
02028	0200	Spices, paprika
02029	0200	Spices, parsley, dried
02030	0200	Spices, pepper, black
02031	0200	Spices, pepper, red or cayenne
02033	0200	Spices, poppy seed
02034	0200	Spices, poultry seasoning
02035	0200	Spices, pumpkin pie spice
02038	0200	Spices, sage, ground
02042	0200	Spices, thyme, dried
02043	0200	Spices, turmeric, ground
02044	0200	Basil, fresh
02046	0200	Mustard, prepared, yellow
02047	0200	Salt, table
02048	0200	Vinegar, cider
02052	0200	Vanilla extract, imitation, no alcohol
02053	0200	Vinegar, distilled
02054	0200	Capers, canned
02055	0200	Horseradish, prepared
03000	0300	Clif Z bar
03001	0300	Babyfood, juice treats, fruit medley, toddler
03002	0300	Babyfood, meat, beef, strained
03003	0300	Babyfood, meat, beef, junior
03005	0300	Babyfood, meat, veal, strained
03008	0300	Babyfood, meat, ham, strained
03010	0300	Babyfood, meat, lamb, strained
03012	0300	Babyfood, meat, chicken, strained
03013	0300	Babyfood, meat, chicken, junior
03014	0300	Babyfood, meat, chicken sticks, junior
03015	0300	Babyfood, meat, turkey, strained
03016	0300	Babyfood, meat, turkey, junior
03017	0300	Babyfood, meat, turkey sticks, junior
03019	0300	Babyfood, snack, GERBER GRADUATE FRUIT  STRIPS, Real Fruit Bars
03021	0300	Babyfood, meat, meat sticks, junior
03022	0300	Babyfood, GERBER, 2nd Foods, apple, carrot and squash, organic
03023	0300	Finger snacks, GERBER GRADUATE PUFFS, apple and cinnamon
03024	0300	Babyfood, water, bottled, GERBER, without added fluoride.
03025	0300	Babyfood, GERBER, 3rd Foods, apple, mango and kiwi
03026	0300	Babyfood, tropical fruit medley
03044	0300	Babyfood, dinner, macaroni and tomato and beef, strained
03045	0300	Babyfood, dinner, macaroni and tomato and beef, junior
03046	0300	Babyfood, ravioli, cheese filled, with tomato sauce
03047	0300	Babyfood, dinner, beef noodle, strained
03048	0300	Babyfood, macaroni and cheese, toddler
03050	0300	Babyfood, dinner, spaghetti and tomato and meat, junior
03052	0300	Babyfood, dinner, beef stew, toddler
03053	0300	Babyfood, dinner, vegetables and beef, strained
03054	0300	Babyfood, dinner, vegetables and beef, junior
03055	0300	Babyfood, dinner, beef with vegetables
03059	0300	Babyfood, dinner, vegetables and bacon, strained
03061	0300	Babyfood, dinner, vegetables and ham, strained
03062	0300	Babyfood, dinner, vegetables and ham, junior
03066	0300	Babyfood, dinner, vegetables and lamb, strained
03068	0300	Babyfood, dinner, chicken noodle, strained
03069	0300	Babyfood, dinner, chicken noodle, junior
03070	0300	Babyfood, dinner, chicken soup, strained
03072	0300	Babyfood, dinner, chicken stew, toddler
03073	0300	Babyfood, dinner, vegetables chicken, strained
03077	0300	Babyfood, dinner, pasta with vegetables
03082	0300	Babyfood, dinner, turkey and rice, strained
03083	0300	Babyfood, dinner, turkey and rice, junior
03084	0300	Babyfood, dinner, vegetables and turkey, strained
03085	0300	Babyfood, dinner, vegetables and turkey, junior
03089	0300	Babyfood, dinner, macaroni and cheese, strained
03090	0300	Babyfood, dinner, macaroni and cheese, junior
03091	0300	Babyfood, vegetables, green beans, strained
03092	0300	Babyfood, vegetables, green beans, junior
03093	0300	Babyfood, green beans, dices, toddler
03096	0300	Babyfood, vegetable, green beans and potatoes
03098	0300	Babyfood, vegetables, beets, strained
03099	0300	Babyfood, vegetables, carrots, strained
03100	0300	Babyfood, vegetables, carrots, junior
03104	0300	Babyfood, vegetables, squash, strained
03105	0300	Babyfood, vegetables, squash, junior
03108	0300	Babyfood, vegetables, sweet potatoes strained
03109	0300	Babyfood, vegetables, sweet potatoes, junior
03112	0300	Babyfood, potatoes, toddler
03114	0300	Babyfood, vegetable, butternut squash and corn
03115	0300	Babyfood, apples, dices, toddler
03116	0300	Babyfood, fruit, applesauce, strained
03117	0300	Babyfood, fruit, applesauce, junior
03118	0300	Babyfood, fruit, apricot with tapioca, strained
03119	0300	Babyfood, vegetables, corn, creamed, strained
03120	0300	Babyfood, vegetables, corn, creamed, junior
03121	0300	Babyfood, vegetables, peas, strained
03122	0300	Babyfood, peas, dices, toddler
03127	0300	Babyfood, vegetables, spinach, creamed, strained
03128	0300	Babyfood, fruit, apricot with tapioca, junior
03129	0300	Babyfood, fruit, bananas with tapioca, strained
03130	0300	Babyfood, fruit, peaches, strained
03131	0300	Babyfood, fruit, peaches, junior
03132	0300	Babyfood, fruit, pears, strained
03133	0300	Babyfood, fruit, pears, junior
03134	0300	Babyfood, fruit, plums with tapioca, without ascorbic acid, strained
03135	0300	Babyfood, fruit, plums with tapioca, without ascorbic acid, junior
03136	0300	Babyfood, fruit, prunes with tapioca, without ascorbic acid, strained
03139	0300	Babyfood, prunes, without vitamin c, strained
03140	0300	Babyfood, fruit dessert, mango with tapioca
03141	0300	Babyfood, pears, dices, toddler
03142	0300	Babyfood, fruit, applesauce and apricots, strained
03143	0300	Babyfood, fruit, applesauce and apricots, junior
03144	0300	Babyfood, fruit, applesauce and cherries, strained
03145	0300	Babyfood, fruit, applesauce and cherries, junior
03147	0300	Babyfood, fruit, applesauce with banana, junior
03152	0300	Babyfood, fruit, apple and raspberry, strained
03153	0300	Babyfood, fruit, apple and raspberry, junior
03154	0300	Babyfood, fruit and vegetable, apple and sweet potato
03156	0300	Babyfood, fruit, bananas and pineapple with tapioca, junior
03157	0300	Babyfood, fruit, bananas and pineapple with tapioca, strained
03158	0300	Babyfood, fruit, pears and pineapple, strained
03159	0300	Babyfood, fruit, pears and pineapple, junior
03161	0300	Babyfood, peaches, dices, toddler
03163	0300	Babyfood, fruit, bananas with apples and pears, strained
03164	0300	Babyfood, fruit, apple and blueberry, strained
03165	0300	Babyfood, fruit, apple and blueberry, junior
03166	0300	Babyfood, juice, apple
03167	0300	Babyfood, apple-banana juice
03168	0300	Babyfood, juice, apple and peach
03169	0300	Babyfood, apple-cranberry juice
03170	0300	Babyfood, juice, apple and plum
03171	0300	Babyfood, juice, apple and prune
03172	0300	Babyfood, juice, orange
03174	0300	Babyfood, juice, orange and apple and banana
03179	0300	Babyfood, juice, mixed fruit
03181	0300	Babyfood, cereal, barley, dry fortified
03184	0300	Babyfood, cereal, whole wheat, with apples, dry fortified
03185	0300	Babyfood, cereal, mixed, dry fortified
03186	0300	Babyfood, cereal, mixed, with bananas, dry
03187	0300	Babyfood, cereal, mixed, with applesauce and bananas, strained
03188	0300	Babyfood, cereal, mixed, with applesauce and bananas, junior
03189	0300	Babyfood, cereal, oatmeal, dry fortified
03190	0300	Babyfood, cereal, oatmeal, with bananas, dry
03191	0300	Babyfood, cereal, oatmeal, with applesauce and bananas, strained
03192	0300	Babyfood, cereal, oatmeal, with applesauce and bananas, junior
03194	0300	Babyfood, cereal, rice, dry fortified
03195	0300	Babyfood, cereal, rice, with applesauce and bananas, strained
03205	0300	Babyfood, oatmeal cereal with fruit, dry, instant, toddler fortified
03206	0300	Babyfood, cookie, baby, fruit
03209	0300	Babyfood, crackers, vegetable
03212	0300	Babyfood, cereal, rice, with bananas, dry
03213	0300	Babyfood, cookies
03215	0300	Babyfood, pretzels
03216	0300	Babyfood, teething biscuits
03217	0300	Zwieback
03220	0300	Babyfood, dessert, dutch apple, strained
03221	0300	Babyfood, dessert, dutch apple, junior
03222	0300	Babyfood, cherry cobbler, junior
03224	0300	Babyfood, dessert, cherry vanilla pudding, strained
03225	0300	Babyfood, dessert, cherry vanilla pudding, junior
03227	0300	Babyfood, dessert, peach cobbler, strained
03228	0300	Babyfood, dessert, peach cobbler, junior
03233	0300	Babyfood, dessert, fruit pudding, pineapple, strained
03235	0300	Babyfood, dessert, fruit dessert, without ascorbic acid, strained
03236	0300	Babyfood, dessert, fruit dessert, without ascorbic acid, junior
03245	0300	Babyfood, dessert, custard pudding, vanilla, strained
03246	0300	Babyfood, dessert, custard pudding, vanilla, junior
03265	0300	Babyfood, juice, apple and grape
03267	0300	Babyfood, juice, fruit punch, with calcium
03268	0300	Babyfood, juice, apple and cherry
03269	0300	Babyfood, juice, apple, with calcium
03274	0300	Babyfood, dinner, vegetables and chicken, junior
03279	0300	Babyfood, dinner, mixed vegetable, junior
03280	0300	Babyfood, fruit, bananas with tapioca, junior
03282	0300	Babyfood, vegetables, mix vegetables junior
03283	0300	Babyfood, vegetables, garden vegetable, strained
03286	0300	Babyfood, vegetables, mix vegetables strained
03287	0300	Babyfood, dinner, beef noodle, junior
03289	0300	Babyfood, apples with ham, strained
03290	0300	Babyfood, carrots and beef, strained
03293	0300	Babyfood, plums, bananas and rice, strained
03296	0300	Babyfood, dinner, turkey, rice, and vegetables, toddler
03297	0300	Babyfood, dinner, apples and chicken, strained
03298	0300	Babyfood, dinner, broccoli and chicken, junior
03301	0300	Babyfood, beverage, GERBER GRADUATE FRUIT SPLASHERS
03302	0300	Babyfood, snack, GERBER GRADUATE YOGURT MELTS
03303	0300	Babyfood, dinner, sweet potatoes and chicken, strained
03304	0300	Babyfood, dinner, potatoes with cheese and ham, toddler
03800	0300	Infant formula, NESTLE, GOOD START SUPREME, with iron, ready-to-feed
03801	0300	Infant formula, NESTLE, GOOD START SUPREME, with iron, liquid concentrate, not reconstituted
03802	0300	Infant formula, NESTLE, GOOD START SUPREME, with iron, powder
03803	0300	Infant formula, MEAD JOHNSON, ENFAMIL, with iron, ready-to-feed
03805	0300	Infant formula, MEAD JOHNSON, ENFAMIL, with iron, powder
03806	0300	Infant formula, MEAD JOHNSON, ENFAMIL, low iron, ready-to-feed
03808	0300	Infant formula, MEAD JOHNSON, ENFAMIL, LIPIL, with iron, powder, with ARA and DHA
03809	0300	Infant formula, MEAD JOHNSON, ENFAMIL, low iron, powder, not reconstituted
03812	0300	Infant formula, MEAD JOHNSON, ENFAMIL, LIPIL, with iron, liquid concentrate, with ARA and DHA
03813	0300	Infant formula, MEAD JOHNSON, ENFAMIL, NUTRAMIGEN, with iron, ready-to-feed
03814	0300	Infant formula, MEAD JOHNSON, ENFAMIL, NUTRAMIGEN, with iron, powder, not reconstituted
03815	0300	Infant formula, MEAD JOHNSON, ENFAMIL LIPIL, with iron, ready-to-feed, with ARA and DHA
03816	0300	Infant formula, MEAD JOHNSON, ENFAMIL, NUTRAMIGEN, with iron, liquid concentrate, not reconstituted
03819	0300	Child formula, MEAD JOHNSON, PORTAGEN, with iron, powder, not reconstituted
03820	0300	Child formula, MEAD JOHNSON, PORTAGEN, with iron, prepared from powder
03821	0300	Infant formula, MEAD JOHNSON, PREGESTIMIL, with iron, powder, not reconstituted
03822	0300	Infant formula, MEAD JOHNSON, PREGESTIMIL, with iron, prepared from powder
03823	0300	Infant formula, MEAD JOHNSON, PROSOBEE, with iron, ready-to-feed
03824	0300	Infant formula, MEAD JOHNSON, PROSOBEE, with iron, liquid concentrate, not reconstituted
03826	0300	Infant formula, MEAD JOHNSON, ENFAMIL, PROSOBEE, with iron, powder, not reconstituted
03827	0300	Infant formula, MEAD JOHNSON, ENFAMIL, LACTOFREE LIPIL, with iron, powder, with ARA and DHA
03830	0300	Infant formula, MEAD JOHNSON, ENFAMIL, LACTOFREE, LIPIL, with iron, liquid concentrate, not reconstituted, with ARA and DHA
03832	0300	Infant formula, MEAD JOHNSON, ENFAMIL, LIPIL, ready-to-feed, with ARA and DHA
03837	0300	Infant formula, ABBOTT NUTRITION, SIMILAC, PM 60/40, powder not reconstituted
03838	0300	Infant formula, MEAD JOHNSON, ENFAMIL, NUTRAMIGEN LIPIL, with iron, powder, not reconstituted, with ARA and DHA
03839	0300	Infant formula, ABBOTT NUTRITION, SIMILAC, NATURAL CARE, ADVANCE, ready-to-feed, with ARA and DHA
03840	0300	Infant formula, ABBOTT NUTRITION, SIMILAC, SPECIAL CARE, ADVANCE 24, with iron, ready-to-feed, with ARA and DHA
03841	0300	Infant formula, ABBOTT NUTRITION, SIMILAC, ISOMIL, with iron, ready-to-feed
03842	0300	Infant formula, ABBOTT NUTRITION, SIMILAC, ISOMIL, with iron, liquid concentrate
03843	0300	Infant formula, ABBOTT NUTRITION, SIMILAC, ISOMIL, with iron, powder, not reconstituted
03844	0300	Infant formula, MEAD JOHNSON, ENFAMIL, NUTRAMIGEN, LIPIL, with iron, liquid concentrate not reconstituted, with ARA and DHA
03845	0300	Infant formula, MEAD JOHNSON, ENFAMIL, NUTRAMIGEN, LIPIL, with iron, ready-to-feed, with ARA and DHA
03846	0300	Infant formula, ABBOTT NUTRITION, SIMILAC, ALIMENTUM, with iron, ready-to-feed
03849	0300	Infant formula, MEAD JOHNSON, ENFAMIL, ENFACARE LIPIL, with iron, powder, with ARA and DHA
03850	0300	Infant formula, ABBOTT NUTRITION, SIMILAC, with iron, ready-to-feed
03851	0300	Infant formula, ABBOTT NUTRITION, SIMILAC, with iron, liquid concentrate, not reconstituted
03852	0300	Infant formula, MEAD JOHNSON, ENFAMIL, PROSOBEE LIPIL, with iron, powder, not reconstituted, with ARA and DHA
03853	0300	Infant formula, ABBOTT NUTRITION, SIMILAC, with iron, powder, not reconstituted
03854	0300	Infant formula, MEAD JOHNSON, ENFAMIL, PROSOBEE, LIPIL, liquid concentrate, not reconstituted, with ARA and DHA
03855	0300	Infant formula, ABBOTT NUTRITION, SIMILAC, low iron, ready-to-feed
03856	0300	Infant formula, ABBOTT NUTRITION, SIMILAC, low iron, liquid concentrate, not reconstituted
03857	0300	Infant formula, MEAD JOHNSON, PROSOBEE LIPIL, with iron, ready to feed, with ARA and DHA
03858	0300	Infant formula, ABBOTT NUTRITION, SIMILAC, low iron, powder, not reconstituted
03859	0300	Infant formula, NESTLE, GOOD START SOY, with DHA and ARA, ready-to-feed
03860	0300	Child formula, ABBOTT NUTRITION, PEDIASURE, ready-to-feed
03867	0300	Infant formula, NESTLE, GOOD START SOY, with ARA and DHA, powder
03868	0300	Infant formula, MEAD JOHNSON, ENFAMIL, LACTOFREE, ready-to-feed
03869	0300	Infant formula, MEAD JOHNSON, ENFAMIL, LACTOFREE, with iron, powder, not reconstituted
03870	0300	Child formula, ABBOTT NUTRITION, PEDIASURE, ready-to-feed, with iron and fiber
03900	0300	Infant formula, NESTLE, GOOD START 2 ESSENTIALS, with iron, ready-to-feed
03901	0300	Infant formula, NESTLE, GOOD START 2 ESSENTIALS, with iron, liquid concentrate, not reconstituted
03913	0300	Infant formula, NESTLE, GOOD START 2 ESSENTIALS, with iron, powder
03925	0300	Infant formula, NESTLE, GOOD START ESSENTIALS SOY, with iron, ready-to-feed
03926	0300	Infant formula, NESTLE, GOOD START ESSENTIALS SOY, with iron, liquid concentrate, not reconstituted
03928	0300	Infant formula, NESTLE, GOOD START ESSENTIALS SOY, with iron, powder
03929	0300	Infant formula, MEAD JOHNSON, NEXT STEP PROSOBEE, powder, not reconstituted
03934	0300	Babyfood, corn and sweet potatoes, strained
03935	0300	Infant formula, ABBOTT NUTRITION, SIMILAC, ALIMENTUM, ADVANCE, ready-to-feed, with ARA and DHA
03936	0300	Infant formula, PBM PRODUCTS, store brand, ready-to-feed
03937	0300	Infant formula, PBM PRODUCTS, store brand, liquid concentrate, not reconstituted
03938	0300	Infant formula, PBM PRODUCTS, store brand, powder
03939	0300	Infant formula, PBM PRODUCTS, store brand, soy, ready-to-feed
03940	0300	Infant formula, PBM PRODUCTS, store brand, soy, liquid concentrate, not reconstituted
03941	0300	Infant formula, PBM PRODUCTS, store brand, soy, powder
03942	0300	Infant formula, MEAD JOHNSON, ENFAMIL, AR LIPIL, ready-to-feed, with ARA and DHA
03943	0300	Infant formula, MEAD JOHNSON, ENFAMIL, AR LIPIL, powder, with ARA and DHA
03944	0300	Infant formula, ABBOTT NUTRITION, SIMILAC NEOSURE, ready-to-feed, with ARA and DHA
03945	0300	Infant formula, ABBOTT NUTRITION, SIMILAC, NEOSURE, powder, with ARA and DHA
03946	0300	Infant formula, ABBOTT NUTRITION, SIMILAC, SENSITIVE (LACTOSE FREE) ready-to-feed, with ARA and DHA
